{
  "schemaVersion": "sacs-v05-active-acceptance-matrix/1.0",
  "supersedes": {
    "packageSha256": "44497cd392ca7b0892da707af97c37f7364ed993d05a89e0b89da51a4bdf128f",
    "rowCount": 418,
    "decision": "SUPERSEDED_STRICT_QUALIFICATION"
  },
  "counts": { "total": 60, "DEVELOPMENT": 38, "INTEGRATION": 12, "RELEASE": 10 },
  "rows": [
    { "id": "DEV-001", "track": "DEVELOPMENT", "blockingScope": "CORE", "scenario": "Current PR implementation preserved", "expected": "PASS", "evidenceGroup": "DEV-SOURCE" },
    { "id": "DEV-002", "track": "DEVELOPMENT", "blockingScope": "CORE", "scenario": "Core contracts build/typecheck", "expected": "PASS", "evidenceGroup": "DEV-CONTRACT" },
    { "id": "DEV-003", "track": "DEVELOPMENT", "blockingScope": "CORE", "scenario": "Session/Revision/Run/Node model passes", "expected": "PASS", "evidenceGroup": "DEV-CONTRACT" },
    { "id": "DEV-004", "track": "DEVELOPMENT", "blockingScope": "CORE", "scenario": "Interactive migration chain is append-only", "expected": "PASS", "evidenceGroup": "DEV-POSTGRES" },
    { "id": "DEV-005", "track": "DEVELOPMENT", "blockingScope": "CORE", "scenario": "Event persistence/projection passes PostgreSQL", "expected": "PASS", "evidenceGroup": "DEV-POSTGRES" },
    { "id": "DEV-006", "track": "DEVELOPMENT", "blockingScope": "CORE", "scenario": "Read-only policy auto-continues", "expected": "PASS", "evidenceGroup": "DEV-POLICY" },
    { "id": "DEV-007", "track": "DEVELOPMENT", "blockingScope": "CORE", "scenario": "Data/Coverage/Capability gaps do not interrupt", "expected": "PASS", "evidenceGroup": "DEV-POLICY" },
    { "id": "DEV-008", "track": "DEVELOPMENT", "blockingScope": "CORE", "scenario": "Outcome-affecting ambiguity interrupts", "expected": "PASS", "evidenceGroup": "DEV-POLICY" },
    { "id": "DEV-009", "track": "DEVELOPMENT", "blockingScope": "CORE", "scenario": "AG-UI v0.2 remains compatible", "expected": "PASS", "evidenceGroup": "DEV-AGUI" },
    { "id": "DEV-010", "track": "DEVELOPMENT", "blockingScope": "CORE", "scenario": "AG-UI v0.3 negotiates", "expected": "PASS", "evidenceGroup": "DEV-AGUI" },
    { "id": "DEV-011", "track": "DEVELOPMENT", "blockingScope": "CORE", "scenario": "Step/Tool/Activity/State projections pass", "expected": "PASS", "evidenceGroup": "DEV-AGUI" },
    { "id": "DEV-012", "track": "DEVELOPMENT", "blockingScope": "CORE", "scenario": "Inspection focus remains local", "expected": "PASS", "evidenceGroup": "DEV-MAP" },
    { "id": "DEV-013", "track": "DEVELOPMENT", "blockingScope": "CORE", "scenario": "Pin does not start analysis", "expected": "PASS", "evidenceGroup": "DEV-MAP" },
    { "id": "DEV-014", "track": "DEVELOPMENT", "blockingScope": "CORE", "scenario": "Authoritative geometry is not mutated", "expected": "PASS", "evidenceGroup": "DEV-MAP" },
    { "id": "DEV-015", "track": "DEVELOPMENT", "blockingScope": "CORE", "scenario": "Public args exclude security/authority fields", "expected": "PASS", "evidenceGroup": "DEV-SECURITY" },
    { "id": "DEV-016", "track": "DEVELOPMENT", "blockingScope": "CORE", "scenario": "Public args are not directly executed", "expected": "PASS", "evidenceGroup": "DEV-CONTROL" },
    { "id": "DEV-017", "track": "DEVELOPMENT", "blockingScope": "CORE", "scenario": "Analysis writes enforce ownership", "expected": "PASS", "evidenceGroup": "DEV-SECURITY" },
    { "id": "DEV-018", "track": "DEVELOPMENT", "blockingScope": "CORE", "scenario": "Stale Proposal CAS conflicts", "expected": "PASS", "evidenceGroup": "DEV-CONTROL" },
    { "id": "DEV-019", "track": "DEVELOPMENT", "blockingScope": "CORE", "scenario": "Proposal idempotency works", "expected": "PASS", "evidenceGroup": "DEV-CONTROL" },
    { "id": "DEV-020", "track": "DEVELOPMENT", "blockingScope": "CORE", "scenario": "Effective edit creates immutable Revision", "expected": "PASS", "evidenceGroup": "DEV-REVISION" },
    { "id": "DEV-021", "track": "DEVELOPMENT", "blockingScope": "CORE", "scenario": "SACS does not calculate node reuse", "expected": "PASS", "evidenceGroup": "DEV-ARCH" },
    { "id": "DEV-022", "track": "DEVELOPMENT", "blockingScope": "CORE", "scenario": "Cancel remains requested until acknowledged", "expected": "PASS", "evidenceGroup": "DEV-CONTROL" },
    { "id": "DEV-023", "track": "DEVELOPMENT", "blockingScope": "CORE", "scenario": "Fixture adapter is non-production only", "expected": "PASS", "evidenceGroup": "DEV-FIXTURE" },
    { "id": "DEV-024", "track": "DEVELOPMENT", "blockingScope": "CORE", "scenario": "Production remains fail-closed", "expected": "PASS", "evidenceGroup": "DEV-FIXTURE" },
    { "id": "DEV-025", "track": "DEVELOPMENT", "blockingScope": "CORE", "scenario": "Developer runtime exposes actual HTTP/AG-UI routes", "expected": "PASS", "evidenceGroup": "DEV-FIXTURE" },
    { "id": "DEV-026", "track": "DEVELOPMENT", "blockingScope": "CORE", "scenario": "Unattended local E2E has zero interrupts", "expected": "PASS", "evidenceGroup": "DEV-E2E" },
    { "id": "DEV-027", "track": "DEVELOPMENT", "blockingScope": "CORE", "scenario": "Map observation local E2E has zero commands", "expected": "PASS", "evidenceGroup": "DEV-E2E" },
    { "id": "DEV-028", "track": "DEVELOPMENT", "blockingScope": "CORE", "scenario": "Pin local E2E does not rerun", "expected": "PASS", "evidenceGroup": "DEV-E2E" },
    { "id": "DEV-029", "track": "DEVELOPMENT", "blockingScope": "CORE", "scenario": "Proposal local E2E creates new Revision", "expected": "PASS", "evidenceGroup": "DEV-E2E" },
    { "id": "DEV-030", "track": "DEVELOPMENT", "blockingScope": "CORE", "scenario": "Ambiguity local E2E creates intervention", "expected": "PASS", "evidenceGroup": "DEV-E2E" },
    { "id": "DEV-031", "track": "DEVELOPMENT", "blockingScope": "CORE", "scenario": "Data Gap local E2E has zero interrupts", "expected": "PASS", "evidenceGroup": "DEV-E2E" },
    { "id": "DEV-032", "track": "DEVELOPMENT", "blockingScope": "CORE", "scenario": "Stale Proposal local E2E returns 409", "expected": "PASS", "evidenceGroup": "DEV-E2E" },
    { "id": "DEV-033", "track": "DEVELOPMENT", "blockingScope": "CORE", "scenario": "Reconnect restores snapshots without rerun", "expected": "PASS", "evidenceGroup": "DEV-E2E" },
    { "id": "DEV-034", "track": "DEVELOPMENT", "blockingScope": "CORE", "scenario": "No direct downstream database access", "expected": "PASS", "evidenceGroup": "DEV-ARCH" },
    { "id": "DEV-035", "track": "DEVELOPMENT", "blockingScope": "CORE", "scenario": "No secret/internal asset leak", "expected": "PASS", "evidenceGroup": "DEV-SECURITY" },
    { "id": "DEV-036", "track": "DEVELOPMENT", "blockingScope": "CORE", "scenario": "DATA_GAP is not false", "expected": "PASS", "evidenceGroup": "DEV-TRUTH" },
    { "id": "DEV-037", "track": "DEVELOPMENT", "blockingScope": "CORE", "scenario": "Geospatial result does not override Task authority", "expected": "PASS", "evidenceGroup": "DEV-TRUTH" },
    { "id": "DEV-038", "track": "DEVELOPMENT", "blockingScope": "CORE", "scenario": "Progressive result reports FEATURE_COMPLETE independently", "expected": "PASS", "evidenceGroup": "DEV-STATUS" },
    { "id": "INT-001", "track": "INTEGRATION", "blockingScope": "TRACK", "scenario": "Real WSGS analysis handoff assessed", "expected": "READY_OR_PENDING", "evidenceGroup": "INT-READINESS" },
    { "id": "INT-002", "track": "INTEGRATION", "blockingScope": "TRACK", "scenario": "Missing handoff yields INTEGRATION_PENDING", "expected": "PASS", "evidenceGroup": "INT-READINESS" },
    { "id": "INT-003", "track": "INTEGRATION", "blockingScope": "TRACK", "scenario": "Real plan/snapshot contract compatible", "expected": "PASS_IF_READY", "evidenceGroup": "INT-HANDOFF" },
    { "id": "INT-004", "track": "INTEGRATION", "blockingScope": "TRACK", "scenario": "Real event transport compatible", "expected": "PASS_IF_READY", "evidenceGroup": "INT-HANDOFF" },
    { "id": "INT-005", "track": "INTEGRATION", "blockingScope": "TRACK", "scenario": "Real revision compile compatible", "expected": "PASS_IF_READY", "evidenceGroup": "INT-HANDOFF" },
    { "id": "INT-006", "track": "INTEGRATION", "blockingScope": "TRACK", "scenario": "Real cancel/intervention compatible", "expected": "PASS_IF_READY", "evidenceGroup": "INT-HANDOFF" },
    { "id": "INT-007", "track": "INTEGRATION", "blockingScope": "TRACK", "scenario": "Http adapter implements stable ports", "expected": "PASS_IF_READY", "evidenceGroup": "INT-ADAPTER" },
    { "id": "INT-008", "track": "INTEGRATION", "blockingScope": "TRACK", "scenario": "Real autonomous run", "expected": "PASS_IF_READY", "evidenceGroup": "INT-E2E" },
    { "id": "INT-009", "track": "INTEGRATION", "blockingScope": "TRACK", "scenario": "Real Proposal/Revision", "expected": "PASS_IF_READY", "evidenceGroup": "INT-E2E" },
    { "id": "INT-010", "track": "INTEGRATION", "blockingScope": "TRACK", "scenario": "Real ambiguity intervention", "expected": "PASS_IF_READY", "evidenceGroup": "INT-E2E" },
    { "id": "INT-011", "track": "INTEGRATION", "blockingScope": "TRACK", "scenario": "Real Data Gap semantics", "expected": "PASS_IF_READY", "evidenceGroup": "INT-E2E" },
    { "id": "INT-012", "track": "INTEGRATION", "blockingScope": "TRACK", "scenario": "Real cancel/reconnect evidence", "expected": "PASS_IF_READY", "evidenceGroup": "INT-E2E" },
    { "id": "REL-001", "track": "RELEASE", "blockingScope": "TRACK", "scenario": "Exact SACS source lock", "expected": "PASS_IF_REQUESTED", "evidenceGroup": "REL-LOCK" },
    { "id": "REL-002", "track": "RELEASE", "blockingScope": "TRACK", "scenario": "Exact upstream contract locks", "expected": "PASS_IF_REQUESTED", "evidenceGroup": "REL-LOCK" },
    { "id": "REL-003", "track": "RELEASE", "blockingScope": "TRACK", "scenario": "Full repository regression", "expected": "PASS_IF_REQUESTED", "evidenceGroup": "REL-TEST" },
    { "id": "REL-004", "track": "RELEASE", "blockingScope": "TRACK", "scenario": "Container qualification", "expected": "PASS_IF_REQUESTED", "evidenceGroup": "REL-CONTAINER" },